{
  "spec_version": "0.1.0",
  "id": "fsl.complex",
  "title": "FSL Complex",
  "command": "fslcomplex",
  "inputs": {
    "args": {
      "type": "string",
      "desc": "Additional parameters to the command",
      "cli": {
        "argstr": "%s"
      }
    },
    "complex_cartesian": {
      "type": "flag",
      "cli": {
        "argstr": "-complex",
        "position": 1
      },
      "constraints": {
        "xor": [
          "real_polar",
          "real_cartesian",
          "complex_polar",
          "complex_split",
          "complex_merge"
        ]
      }
    },
    "complex_in_file": {
      "type": "file",
      "cli": {
        "argstr": "%s",
        "position": 2
      }
    },
    "complex_in_file2": {
      "type": "file",
      "cli": {
        "argstr": "%s",
        "position": 3
      }
    },
    "complex_merge": {
      "type": "flag",
      "cli": {
        "argstr": "-complexmerge"
      },
      "constraints": {
        "xor": [
          "real_polar",
          "real_cartesian",
          "complex_cartesian",
          "complex_polar",
          "complex_split",
          "start_vol",
          "end_vol"
        ]
      }
    },
    "complex_out_file": {
      "type": "file",
      "cli": {
        "argstr": "%s",
        "position": -3
      },
      "constraints": {
        "xor": [
          "magnitude_out_file",
          "phase_out_file",
          "real_out_file",
          "imaginary_out_file",
          "real_polar",
          "real_cartesian"
        ]
      }
    },
    "complex_polar": {
      "type": "flag",
      "cli": {
        "argstr": "-complexpolar"
      },
      "constraints": {
        "xor": [
          "real_polar",
          "real_cartesian",
          "complex_cartesian",
          "complex_split",
          "complex_merge"
        ]
      }
    },
    "complex_split": {
      "type": "flag",
      "cli": {
        "argstr": "-complexsplit"
      },
      "constraints": {
        "xor": [
          "real_polar",
          "real_cartesian",
          "complex_cartesian",
          "complex_polar",
          "complex_merge"
        ]
      }
    },
    "end_vol": {
      "type": "int",
      "cli": {
        "argstr": "%d",
        "position": -1
      }
    },
    "imaginary_in_file": {
      "type": "file",
      "cli": {
        "argstr": "%s"
      }
    },
    "imaginary_out_file": {
      "type": "file",
      "cli": {
        "argstr": "%s"
      },
      "constraints": {
        "xor": [
          "complex_out_file",
          "magnitude_out_file",
          "phase_out_file",
          "real_polar",
          "complex_cartesian",
          "complex_polar",
          "complex_split",
          "complex_merge"
        ]
      }
    },
    "magnitude_in_file": {
      "type": "file",
      "cli": {
        "argstr": "%s"
      }
    },
    "magnitude_out_file": {
      "type": "file",
      "cli": {
        "argstr": "%s",
        "position": -4
      },
      "constraints": {
        "xor": [
          "complex_out_file",
          "real_out_file",
          "imaginary_out_file",
          "real_cartesian",
          "complex_cartesian",
          "complex_polar",
          "complex_split",
          "complex_merge"
        ]
      }
    },
    "phase_in_file": {
      "type": "file",
      "cli": {
        "argstr": "%s"
      }
    },
    "phase_out_file": {
      "type": "file",
      "cli": {
        "argstr": "%s"
      },
      "constraints": {
        "xor": [
          "complex_out_file",
          "real_out_file",
          "imaginary_out_file",
          "real_cartesian",
          "complex_cartesian",
          "complex_polar",
          "complex_split",
          "complex_merge"
        ]
      }
    },
    "real_cartesian": {
      "type": "flag",
      "cli": {
        "argstr": "-realcartesian"
      },
      "constraints": {
        "xor": [
          "real_polar",
          "complex_cartesian",
          "complex_polar",
          "complex_split",
          "complex_merge"
        ]
      }
    },
    "real_in_file": {
      "type": "file",
      "cli": {
        "argstr": "%s"
      }
    },
    "real_out_file": {
      "type": "file",
      "cli": {
        "argstr": "%s"
      },
      "constraints": {
        "xor": [
          "complex_out_file",
          "magnitude_out_file",
          "phase_out_file",
          "real_polar",
          "complex_cartesian",
          "complex_polar",
          "complex_split",
          "complex_merge"
        ]
      }
    },
    "real_polar": {
      "type": "flag",
      "cli": {
        "argstr": "-realpolar"
      },
      "constraints": {
        "xor": [
          "real_cartesian",
          "complex_cartesian",
          "complex_polar",
          "complex_split",
          "complex_merge"
        ]
      }
    },
    "start_vol": {
      "type": "int",
      "cli": {
        "argstr": "%d",
        "position": -2
      }
    }
  },
  "outputs": {
    "complex_out_file": {
      "type": "file",
      "path": {
        "from_input": "complex_out_file"
      },
      "must_exist": false
    },
    "imaginary_out_file": {
      "type": "file",
      "path": {
        "from_input": "imaginary_out_file"
      },
      "must_exist": false
    },
    "magnitude_out_file": {
      "type": "file",
      "path": {
        "from_input": "magnitude_out_file"
      },
      "must_exist": false
    },
    "phase_out_file": {
      "type": "file",
      "path": {
        "from_input": "phase_out_file"
      },
      "must_exist": false
    },
    "real_out_file": {
      "type": "file",
      "path": {
        "from_input": "real_out_file"
      },
      "must_exist": false
    }
  },
  "runtime": {
    "profile": "fsl"
  },
  "origin": {
    "source": "nipype",
    "nipype_class": "nipype.interfaces.fsl.utils.Complex",
    "nipype_version": "1.10.0"
  },
  "description": "fslcomplex is a tool for converting complex data"
}
